{
  "$schema": "https://json-schema.org/draft/2020-12/schema",
  "$id": "https://gmp.dev/contracts/schemas/events/event-envelope-base.schema.json",
  "title": "EventEnvelopeBase",
  "type": "object",
  "required": ["eventId", "eventType", "occurredAt", "source", "payload"],
  "properties": {
    "eventId": { "type": "string", "minLength": 1 },
    "eventType": { "type": "string", "minLength": 1 },
    "occurredAt": { "type": "string", "format": "date-time" },
    "source": { "type": "string", "minLength": 1 },
    "correlationId": { "type": "string" },
    "payload": { "type": "object" }
  },
  "additionalProperties": false
}
