{
  "eventId": "evt-1b2c3d4e",
  "eventType": "journal.message.expired",
  "occurredAt": "2026-10-01T16:00:00Z",
  "source": "gateway-anl-01",
  "correlationId": "corr-9b1d44",
  "payload": {
    "runId": "run-7f3e2a",
    "failureClass": "F0_NONE",
    "details": {
      "messageId": "msg-5e6f7a",
      "expiresAt": "2026-10-01T15:55:00Z",
      "disposition": "expired_dropped"
    }
  }
}
